company_name,salers
fresh fruits,"Leonard Cohen,  Luke Skywalker,  Ammy Winehouse, Luke Skywalker"
veggies,"Luke Skywalker,  David Goliat,  Leon Leonov"
seafood supplier,"David Goliat,  Leonard Cohen, Markus Söder,  Ammy Winehouse"
meat packers,"Chris Pratt,  David Henderson,  Marianov Merschik,  Leon Leonov"
green veg,"Leonard Cohen,  David Henderson"
organic farms,"David Henderson,  Leonard Cohen,  Leon Leonov"
tropical fruits,"Yuri Gagarin,  David Goliat,  David Henderson, Yuri Gagarin,  David Goliat,  David Henderson"
healthy snacks,"Ammy Winehouse,  Marie Curie,  Chris Pratt, Marianov Merschik,  Vladimir Chukov,  Luke Skywalker"
